{
  "architecture": {
    "activation": "tanh",
    "dtype": "float64",
    "hidden_widths": [
      16,
      16
    ],
    "input_names": [
      "x",
      "t"
    ],
    "output_names": [
      "u"
    ],
    "type": "dense_mlp"
  },
  "artifact_id": "fisher-kpp-pinn-seed-20260901",
  "artifact_kind": "trained_callable",
  "problem_id": "fisher-kpp-classical-01",
  "schema_version": 1,
  "state_dict": {
    "0.bias": [
      0.4851602654436141,
      0.21851201201385684,
      -0.5206231116637676,
      -0.5470393242779804,
      -0.7413679470566154,
      -0.3066922620859762,
      -0.7715221069381062,
      -0.7059478131550787,
      0.01617523844719947,
      -0.46319483249039883,
      -0.2007203149388005,
      0.5782737039389142,
      0.35156567842919284,
      0.5875455711268118,
      0.9656315337767488,
      -0.6149960117798329
    ],
    "0.weight": [
      [
        0.2387430782910415,
        -0.534113864361545
      ],
      [
        0.38375013443905037,
        0.36952826497139
      ],
      [
        0.23048502407914037,
        -0.04907880261465447
      ],
      [
        -0.10508023269092988,
        -0.21353634267175983
      ],
      [
        -0.11958242856442866,
        -0.5182541996226003
      ],
      [
        -0.2514698068857642,
        0.4313002327687407
      ],
      [
        0.0078535006285169,
        0.11732532266316407
      ],
      [
        -0.01719339944266955,
        0.01580851745762012
      ],
      [
        0.14917798575500493,
        -0.17946394040286123
      ],
      [
        -0.22969512716427704,
        0.7094951974830349
      ],
      [
        0.4225431489448373,
        -0.9058151645422605
      ],
      [
        -0.23275039138675516,
        -0.29292814055640676
      ],
      [
        0.4952938451353533,
        0.41655722362580283
      ],
      [
        0.1716098660049323,
        0.4094365375433962
      ],
      [
        0.24631610290458766,
        -0.3304823964619221
      ],
      [
        0.1328369329022126,
        0.0922241752486812
      ]
    ],
    "2.bias": [
      0.17723267661296654,
      -0.30699096742896104,
      -0.17499918336327808,
      0.07855303286494342,
      0.07591305330894278,
      -0.059154135911910474,
      0.30019157626080634,
      0.05788504715047459,
      0.16988537442902774,
      -0.057642830959014714,
      0.19529076449276023,
      0.1658521916358449,
      -0.11438756274503703,
      0.2187890812082143,
      0.08264849452265723,
      -0.27797733080699233
    ],
    "2.weight": [
      [
        0.19532007503567092,
        -0.18266116647601313,
        -0.004530414277933851,
        -0.07782935849215285,
        0.19102257719494162,
        -0.26963546737866234,
        -0.05249088513507369,
        0.003186062908429505,
        -0.029057269991851493,
        0.0772699222740638,
        -0.15865521639540575,
        0.10842053665705492,
        0.1398694916257254,
        -0.2768579611661308,
        0.03852532955773096,
        0.07671965003388181
      ],
      [
        -0.01592668419870801,
        -0.06430668429804388,
        -0.20805870732989204,
        0.07687355276220136,
        0.18592678167243287,
        0.0790822527194525,
        -0.004992105895786125,
        0.1228497491258047,
        0.155681592120883,
        -0.04225673589180747,
        0.08522687288125318,
        -0.17943702117657323,
        -0.10816772457032095,
        0.0698662187036951,
        0.1416949455622674,
        0.10585171472169526
      ],
      [
        0.03236708362142169,
        0.19980954748533106,
        0.17211273919956246,
        -0.09081782595379576,
        -0.2812945758641954,
        0.2245466653555023,
        -0.06912788995450458,
        -0.035549221216836464,
        -0.11035527858287125,
        0.23873040481941227,
        -0.08546681927773606,
        -0.1459914020270294,
        -0.1765184095086158,
        0.15759309505717684,
        -0.19719274626967379,
        -0.1430596809105657
      ],
      [
        0.13429286565271384,
        0.2395612516727955,
        0.1781276982416743,
        0.01622589060338926,
        -0.02959733410465943,
        -0.1529297364590987,
        -0.13562115416473194,
        0.005231180262545371,
        -0.005659744530337321,
        -0.2223532159999268,
        0.21476818542185624,
        0.03877056791950904,
        0.05789381128095689,
        -0.06356961033856645,
        -0.046405663138727425,
        -0.09660502774362398
      ],
      [
        0.01276263888302595,
        -0.04938756136849819,
        0.031676745192475673,
        0.10613665948836543,
        -0.12763736618741403,
        -0.0011098790135838246,
        -0.08006047764515714,
        -0.2979934886503845,
        0.018141083859654142,
        0.16894037468134107,
        -0.14564250640847198,
        0.1821641748542897,
        0.021754879647649494,
        -0.12970431763395712,
        -0.024958981914123077,
        -0.23212812447048742
      ],
      [
        0.06484203395848175,
        0.09651932295496539,
        0.19222783582469996,
        0.028837063092202842,
        -0.13025717243015658,
        -0.0002694869559793852,
        0.22962911141408815,
        -0.19538921047768398,
        -0.03330184368097518,
        -0.39557347932700637,
        0.04787439250363672,
        0.07783975734520478,
        -0.11157062997101411,
        0.10969215733312906,
        -0.05745828684752749,
        0.2757787354674051
      ],
      [
        -0.011139640201539411,
        -0.24193435785116402,
        0.07760670070712175,
        -0.019608723067015655,
        -0.16918103801522938,
        0.3463928194832156,
        -0.32286760928569225,
        -0.13811073629688442,
        0.16618483649109633,
        0.04671802594439491,
        -0.006380385637061572,
        -0.003873163168652384,
        -0.07612801944568008,
        -0.0627388708223061,
        0.08076920324223741,
        0.17089173152362946
      ],
      [
        -0.22968863331410333,
        -0.28243372762013025,
        -0.08659549388849716,
        0.07936815331767921,
        0.062394395120903084,
        -0.2230301842794472,
        0.2161515528193688,
        0.09071008927860524,
        0.08702780819356762,
        0.133979922863006,
        0.10858821764626882,
        0.22591441817269606,
        0.08198141452569851,
        -0.24612135442844055,
        0.2140006141788939,
        0.1753981712748124
      ],
      [
        -0.0034192912591208715,
        0.007326530475292835,
        -0.06301881039669124,
        0.029411989961484607,
        -0.0902418234787943,
        0.07151014210819902,
        -0.24801029787905876,
        0.09302584263479877,
        0.14035438879916878,
        0.21769356865291667,
        -0.21162222474264952,
        0.0479634626671853,
        -0.02302463102747096,
        -0.10082034583947959,
        0.17615508758498435,
        -0.26584872416646826
      ],
      [
        0.17405041571517918,
        -0.07837135764608849,
        -0.21182158543912089,
        -0.27762850991781696,
        -0.09824436034140958,
        0.17622684700952948,
        -0.1346281661603632,
        -0.033227235539196646,
        0.2011143678635444,
        0.19660544756584342,
        0.07070477905952045,
        -0.09390639576838197,
        -0.03373299631312508,
        -0.141662167910998,
        -0.19887317009143302,
        0.11080627092354882
      ],
      [
        0.06562981585820651,
        -0.14919720746841048,
        0.1869421099947441,
        -0.0344543571102934,
        -0.10401654384486839,
        0.17441809580446307,
        0.13169098891677705,
        -0.08017749802185703,
        -0.101546510763349,
        0.10370179598684337,
        0.23022529418724558,
        -0.09283513330591929,
        0.17871909717117823,
        0.08502495069610191,
        -0.09597387959556021,
        -0.1627772614506482
      ],
      [
        -0.19244537439008683,
        0.09143970717478271,
        0.09324073174417534,
        -0.24590772007223585,
        -0.03277575074923483,
        0.09353519631999092,
        -0.004867940024252307,
        -0.035887682799997905,
        0.08604251098066601,
        -0.1412924946276065,
        0.02515449430832656,
        0.01029022687094435,
        -0.00672742981616006,
        -0.16201852416206494,
        -0.15797210970034176,
        -0.05465734416263051
      ],
      [
        0.10843771983373442,
        0.1569471768361706,
        -0.14675160689468522,
        -0.12872797944285794,
        -0.14337646015597405,
        0.30283795746430187,
        -0.29532682575318564,
        -0.02257914407012988,
        -0.23499760539075484,
        -0.08898471750064275,
        0.1894204517946847,
        -0.2107258195102737,
        0.09963418585047217,
        0.016452090791967227,
        -0.32543995296251693,
        0.15057819937628664
      ],
      [
        0.23183080844328788,
        -0.10306843972632009,
        -0.0029549353932965218,
        0.02960084803873582,
        -0.15283959779375364,
        0.17637772449198463,
        -0.26377292043387407,
        -0.06500653471214571,
        -0.18481175517931486,
        0.051182563958174616,
        -0.04376521801228087,
        0.10475173580474492,
        0.07120445194433049,
        -0.04994941818528246,
        -0.13737011149589273,
        0.23905295333380674
      ],
      [
        -0.1298713195960371,
        0.18045655018560064,
        0.020444464340410497,
        -0.1582559880531447,
        0.16353484898554288,
        0.21250185968360305,
        -0.10905551327759173,
        -0.017033854795027278,
        -0.19840937552744103,
        -0.061448468602532,
        -0.09769805608947192,
        -0.25262297246392473,
        -0.005085406766873008,
        -0.1762568989406746,
        -0.24554350602546435,
        -0.009592094312788128
      ],
      [
        -0.12237379629507229,
        0.019491769869767223,
        -0.08050993336841934,
        0.10617906271400984,